{
  "$schema": "../../schemas/pmndrs.schema.json",
  "title": "Cards With Border Radius",
  "description": "",
  "tags": ["scroll", "infinite", "shader"],
  "authors": ["Paul Henschel"],
  "publishedAt": "2024-01-18",
  "source": "https://codesandbox.io/s/9s2wd9",
  "libraries": ["@react-three/drei", "@react-three/fiber"],
  "assets": []
}
