{
  "$schema": "../../schemas/pmndrs.schema.json",
  "title": "SVG Renderer",
  "description": "Using the render function to inject custom renderers.",
  "tags": ["custom-renderer"],
  "authors": ["Paul Henschel"],
  "publishedAt": "2021-03-30",
  "source": "https://codesandbox.io/s/zcuqh",
  "libraries": ["@react-three/fiber"],
  "assets": []
}
