{
  "$schema": "../../schemas/pmndrs.schema.json",
  "title": "Grid",
  "description": "A Suzanne model staged with drei's Stage helper, overlaid with @react-three/postprocessing's Grid effect.",
  "tags": ["postprocessing", "grid"],
  "authors": ["Sara Vieira"],
  "source": "https://codesandbox.io/s/9ebpg",
  "libraries": [
    "@react-three/drei",
    "@react-three/fiber",
    "@react-three/postprocessing",
    "leva"
  ],
  "assets": [
    {
      "name": "Suzanne",
      "files": ["src/suzanne.gltf"],
      "notes": "Blender's mascot mesh, bundled with the original CodeSandbox demo."
    }
  ]
}
