{
  "$schema": "../../schemas/pmndrs.schema.json",
  "title": "Interactive Spline Scene Live HTML",
  "description": "Scene exported with Spline",
  "tags": ["stencil", "html"],
  "authors": ["Paul Henschel"],
  "publishedAt": "2022-06-15",
  "source": "https://codesandbox.io/s/f79ucc",
  "libraries": ["@react-three/drei", "@react-three/fiber"],
  "assets": []
}
