{
  "$schema": "../../schemas/pmndrs.schema.json",
  "title": "Brightness / Contrast",
  "description": "A Suzanne model staged with drei's Stage helper, graded with @react-three/postprocessing's BrightnessContrast effect.",
  "tags": ["postprocessing", "brightness-contrast"],
  "authors": ["Sara Vieira"],
  "source": "https://codesandbox.io/s/rrev1",
  "libraries": [
    "@react-three/drei",
    "@react-three/fiber",
    "@react-three/postprocessing",
    "leva"
  ],
  "assets": []
}
