{
  "$schema": "../../schemas/pmndrs.schema.json",
  "title": "Glass Flower",
  "description": "",
  "tags": ["transmission"],
  "authors": ["Paul Henschel"],
  "publishedAt": "2023-04-13",
  "source": "https://codesandbox.io/s/dq6wwe",
  "libraries": ["@react-three/drei", "@react-three/fiber", "@react-three/postprocessing"],
  "assets": []
}
