{
  "$schema": "../../schemas/pmndrs.schema.json",
  "title": "Star Wars",
  "description": "",
  "tags": ["ssr", "bloom", "hdr"],
  "authors": ["Paul Henschel"],
  "publishedAt": "2022-07-12",
  "source": "https://codesandbox.io/s/fslt99",
  "libraries": [
    "@react-three/drei",
    "@react-three/fiber",
    "@react-three/postprocessing",
    "leva"
  ],
  "assets": []
}
