{
  "$schema": "../../schemas/pmndrs.schema.json",
  "title": "Env Map Ground Projection",
  "description": "",
  "tags": ["ground-projection", "reflections"],
  "authors": ["Faraz Shaikh"],
  "publishedAt": "2022-04-10",
  "source": "https://codesandbox.io/s/q48jgy",
  "libraries": ["@react-three/drei", "@react-three/fiber", "leva"],
  "assets": []
}
