{
  "$schema": "../../schemas/pmndrs.schema.json",
  "title": "Progressive Loading States With Suspense",
  "description": "Demonstrates how to load a model progressively with fallbacks via React.Suspense.",
  "tags": ["gltf", "suspense", "loading"],
  "authors": ["Paul Henschel"],
  "publishedAt": "2021-02-08",
  "source": "https://codesandbox.io/s/7duy8",
  "libraries": ["@react-three/drei", "@react-three/fiber"],
  "assets": []
}
