{
  "$schema": "../../schemas/pmndrs.schema.json",
  "title": "Arkanoid Under 60 LOC",
  "description": "Super small Arkanoid barebones implementation.",
  "tags": ["collisions", "physics"],
  "authors": ["Paul Henschel"],
  "publishedAt": "2020-06-19",
  "source": "https://codesandbox.io/s/66cd7",
  "libraries": ["@react-three/fiber", "@react-three/rapier"],
  "assets": []
}
